{
  "name": "enzyme_immobilization_formulation_optimizer_v1",
  "version": "v1-seed-20260526",
  "description": "Field-level formulation optimization benchmark. Seed cases focus on BCL-ZIF-8 and evidence-backed starting-point recommendations.",
  "target_case_count": 20,
  "defaults": {
    "endpoint": "optimize",
    "top_k": 5,
    "usable_only": true,
    "objective": "optimize_formulation",
    "literature_rewrite": false,
    "expected_behavior": {
      "requires_citations": true,
      "min_expected_changes": 1,
      "min_evidence_backed_change_rate": 0.9,
      "forbid_global_optimum": true
    }
  },
  "cases": [
    {
      "id": "fo_bcl_zif8_loading_ph_time",
      "kind": "formulation",
      "query": "BCL-ZIF-8 配方优化：enzyme loading 500 mg/g，pH 7.0，25°C，60 min，用于 soybean oil ethanol biodiesel。",
      "enzyme_name": "Burkholderia cepacia lipase",
      "application_context": "大豆油与乙醇转酯制备 biodiesel，关注活性回收、产率和重复使用。",
      "difficulty": "medium",
      "source": "manual_user_like",
      "construction_note": "Functional-test formulation case. Expected suggestions are evidence-backed starting points, not global optima.",
      "user_formulation": {
        "carrier": "ZIF-8",
        "enzyme_loading": {"value": 500, "unit": "mg/g"},
        "buffer": {"pH": 7.0},
        "immobilization_conditions": {
          "temperature": {"value": 25, "unit": "degC"},
          "time": {"value": 60, "unit": "min"}
        }
      },
      "expected_evidence": [
        {"document_id": "B10", "record_type": "formulation_condition", "text_contains_any": ["700", "30 min", "7.5", "25"]}
      ],
      "expected_changes": [
        {"field_path": "buffer.pH", "recommended_contains": "7.5"},
        {"field_path": "immobilization_conditions.time", "recommended_contains": "30"}
      ],
      "forbidden_claims": ["全局最优", "唯一最佳", "保证 100%"]
    },
    {
      "id": "fo_bcl_zif8_missing_conditions",
      "kind": "formulation",
      "query": "我只有 BCL 和 ZIF-8，想做固定化，没写 pH 和时间。",
      "enzyme_name": "Burkholderia cepacia lipase",
      "application_context": "BCL-ZIF-8 固定化 starting point，关注 activity recovery。",
      "difficulty": "medium",
      "source": "manual_user_like",
      "construction_note": "Sparse formulation should still suggest evidence-backed fields and expose missing inputs.",
      "user_formulation": {
        "carrier": "ZIF-8"
      },
      "expected_evidence": [
        {"document_id": "B10", "record_type": "formulation_condition", "text_contains_any": ["700", "30 min", "7.5", "25"]}
      ],
      "expected_changes": [
        {"field_path": "enzyme.amount", "recommended_contains": "700"},
        {"field_path": "buffer.pH", "recommended_contains": "7.5"}
      ],
      "forbidden_claims": ["全局最优", "唯一最佳"]
    },
    {
      "id": "fo_magnetic_mof_reuse",
      "kind": "formulation",
      "query": "磁性 MOF 固定化脂肪酶，想提高重复使用稳定性，当前只有 carrier=magnetic nanoparticle。",
      "enzyme_name": "lipase",
      "application_context": "固定化 lipase 配方优化，关注操作稳定性和 evidence traceability。",
      "difficulty": "hard",
      "source": "manual_user_like",
      "construction_note": "Magnetic MOF formulation case; expected evidence can come from related magnetic carrier literature.",
      "user_formulation": {
        "carrier": "magnetic nanoparticle",
        "buffer": {"pH": 7.0}
      },
      "expected_evidence": [
        {"text_contains_any": ["magnetic", "MNP", "Fe3O4", "reuse", "reusability"]}
      ],
      "expected_changes": [],
      "expected_behavior": {
        "requires_citations": true,
        "min_expected_changes": 0,
        "min_evidence_backed_change_rate": 0.0,
        "forbid_global_optimum": true
      },
      "forbidden_claims": ["全局最优", "唯一最佳", "保证"]
    },
    {
      "id": "fo_no_glutaraldehyde_constraint",
      "kind": "formulation",
      "query": "不要戊二醛，有没有更温和的脂肪酶固定化配方 starting point？",
      "enzyme_name": "lipase",
      "application_context": "不要戊二醛，寻找更温和的固定化 starting point。",
      "constraints": ["avoid glutaraldehyde", "mild immobilization conditions"],
      "difficulty": "hard",
      "source": "manual_user_like",
      "construction_note": "Negative/exclusion constraint for unsafe overgeneralized crosslinker recommendation.",
      "user_formulation": {
        "avoid": ["glutaraldehyde"],
        "carrier": null
      },
      "expected_evidence": [
        {"text_contains_any": ["adsorption", "biomineralization", "ZIF-8", "mild"]}
      ],
      "expected_changes": [],
      "expected_behavior": {
        "requires_citations": true,
        "min_expected_changes": 0,
        "min_evidence_backed_change_rate": 0.0,
        "forbid_global_optimum": true
      },
      "forbidden_claims": ["必须使用戊二醛", "只能用戊二醛", "全局最优"]
    }
  ]
}
